{"artifact":{"path":"engines/impeccable/dist/impeccable-0.1.17+floe.1.0.0/riscv64gc-unknown-linux-musl/floe-impeccable","sha256":"af8795bf9636e763541c58ef90ee889941e468f453ec6580c32a89a5a758b87b","size":5579704},"captureContract":{"sha256":"baf2453164be6162703af9d671be16da152fa874db53ce95ad5b3516d40de4a3","version":1},"componentID":"impeccable-engine","componentVersion":"0.1.17+floe.1.0.0","minimumAppVersion":"1.7.59","schemaVersion":1,"target":{"arch":"riscv64","format":"elf64-little-riscv-exec-static","os":"linux","triple":"riscv64gc-unknown-linux-musl"}}